{"allowed":["body","expr"],"calls":[["sym:builtin:Err","fn(E) -> Result[T, E]"],["sym:builtin:Ok","fn(T) -> Result[T, E]"]],"capabilities":[],"contracts":[],"effects":[],"hash":"sha256:0ec2869f990e37fdb4bd7b1a48a839f350426006b22e9d8924686b688ff54069","success":"Change `solve_sp_111` so zero is the only error and value 141 with divisor one returns 141.","target":{"failure":"String","id":"sym:fn:solve_sp_111","params":[{"name":"value","type":"Int"},{"name":"divisor","type":"Int"}],"return":"Result[Int, String]","type":"fn(Int, Int) -> Result[Int, String]"},"types":[],"v":1,"values":[["sym:fn:solve_sp_111/param:divisor","Int"],["sym:fn:solve_sp_111/param:value","Int"]]}
