{"allowed":["body","expr"],"calls":[],"capabilities":[],"contracts":[],"effects":[],"hash":"sha256:45596795befd47173aa062f325a328944ae82be6b35bc9f76799ea2dd26c146a","success":"Change record-based `solve_sp_130` so an enabled packet adds 10 instead of 3. It must print 170.","target":{"failure":null,"id":"sym:fn:solve_sp_130","params":[{"name":"packet","type":"PacketSp130"}],"return":"Int","type":"fn(PacketSp130) -> Int"},"types":[{"def":{"fields":[{"name":"value","type":"Int"},{"name":"enabled","type":"Bool"}]},"id":"type:record:PacketSp130","kind":"record"}],"v":1,"values":[["sym:fn:solve_sp_130/param:packet","PacketSp130"]]}
