{"allowed":["body","expr"],"calls":[],"capabilities":[],"contracts":[],"effects":[],"hash":"sha256:b93eeccecb2ee46b72aa628dead7b53f123aaa988d9cba6ceb90b04778b62238","success":"Change `solve_sp_117` so the boundary is inclusive and the accepted branch adds 11. The exact-boundary caller must print 158.","target":{"failure":null,"id":"sym:fn:solve_sp_117","params":[{"name":"value","type":"Int"},{"name":"limit","type":"Int"}],"return":"Int","type":"fn(Int, Int) -> Int"},"types":[],"v":1,"values":[["sym:fn:solve_sp_117/param:limit","Int"],["sym:fn:solve_sp_117/param:value","Int"]]}
