{"allowed":["body","expr"],"calls":[],"capabilities":[],"contracts":[],"effects":[],"hash":"sha256:1b2bb3e356e315890ce14de3a4a8e5bd0dd127a795c6bc814047a97a3174c899","success":"Change `solve_sp_152` to add 11 instead of 1. Keep the caller unchanged; it must print 193.","target":{"failure":null,"id":"sym:fn:solve_sp_152","params":[{"name":"value","type":"Int"}],"return":"Int","type":"fn(Int) -> Int"},"types":[],"v":1,"values":[["sym:fn:solve_sp_152/param:value","Int"]]}
